{
  "schema_version": 1,
  "id": "tidal_observatory",
  "version": "0.1.0",
  "title": "Nova's Tidal Observatory",
  "description": "An orbital habitat links its central research deck to a telescope wing over an open bridge. Nova studies simulated signals and assembles a finite tidal atlas.",
  "brief_path": "res://content/briefs/tidal_observatory.json",
  "character_path": "res://content/characters/nova.json",
  "routine_path": "res://content/routines/tidal_observatory.json",
  "asset_manifest_paths": [
    "res://content/assets/tidal_observatory.json"
  ],
  "environment": {
    "background": "#101b31",
    "ambient": "#899ecc",
    "light_color": "#c1e5ff",
    "light_energy": 1.3
  },
  "camera": {
    "position": [
      16,
      19,
      24
    ],
    "target": [
      0.5,
      0,
      -0.5
    ],
    "size": 20
  },
  "navigation": {
    "cell_size": 0.5,
    "character_radius": 0.3
  },
  "spawn": [
    -4,
    0,
    0
  ],
  "zones": [
    {
      "id": "central_deck",
      "label": "Central research deck",
      "center": [
        -4,
        0,
        0
      ],
      "size": [
        8,
        8
      ],
      "color": "#3f5773"
    },
    {
      "id": "bridge",
      "label": "Open skybridge",
      "center": [
        1.5,
        0,
        0
      ],
      "size": [
        3,
        2
      ],
      "color": "#60758c"
    },
    {
      "id": "observation_wing",
      "label": "Observation wing",
      "center": [
        6,
        0,
        0
      ],
      "size": [
        6,
        6
      ],
      "color": "#52627e"
    }
  ],
  "objects": [
    {
      "id": "work_console",
      "asset_id": "holographic_console",
      "position": [
        -2,
        0,
        -2.5
      ],
      "rotation_y": 0,
      "scale": [
        1,
        1,
        1
      ]
    },
    {
      "id": "comms_terminal",
      "asset_id": "comms_orb",
      "position": [
        -2,
        0,
        2.5
      ],
      "rotation_y": 0,
      "scale": [
        1,
        1,
        1
      ]
    },
    {
      "id": "rest_capsule",
      "asset_id": "sleep_capsule",
      "position": [
        -6,
        0,
        2.5
      ],
      "rotation_y": 0,
      "scale": [
        1,
        1,
        1
      ]
    },
    {
      "id": "spectrum_archive",
      "asset_id": "archive_prism",
      "position": [
        -6,
        0,
        -2.5
      ],
      "rotation_y": 0,
      "scale": [
        1,
        1,
        1
      ]
    },
    {
      "id": "long_scope",
      "asset_id": "observatory_scope",
      "position": [
        6,
        0,
        -1
      ],
      "rotation_y": 0,
      "scale": [
        1,
        1,
        1
      ]
    },
    {
      "id": "atlas_plinth",
      "asset_id": "mapping_table",
      "position": [
        7,
        0,
        2
      ],
      "rotation_y": 0,
      "scale": [
        1,
        1,
        1
      ]
    },
    {
      "id": "tidal_atlas",
      "asset_id": "map_project",
      "position": [
        7,
        1.05,
        2
      ],
      "rotation_y": 0,
      "scale": [
        1,
        1,
        1
      ]
    },
    {
      "id": "signal_study",
      "asset_id": "signal_project",
      "position": [
        -6,
        1.65,
        -2.5
      ],
      "rotation_y": 0,
      "scale": [
        1,
        1,
        1
      ]
    },
    {
      "id": "aft_rail",
      "asset_id": "orbital_rear_rail",
      "position": [
        -4,
        0,
        -4
      ],
      "rotation_y": 0,
      "scale": [
        1,
        1,
        1
      ]
    },
    {
      "id": "bridge_marker_left",
      "asset_id": "bridge_light",
      "position": [
        0.5,
        0,
        0
      ],
      "rotation_y": 0,
      "scale": [
        1,
        1,
        1
      ]
    },
    {
      "id": "bridge_marker_right",
      "asset_id": "bridge_light",
      "position": [
        2.5,
        0,
        0
      ],
      "rotation_y": 0,
      "scale": [
        1,
        1,
        1
      ]
    },
    {
      "id": "distant_planet",
      "asset_id": "planet",
      "position": [
        5,
        -1.5,
        -9
      ],
      "rotation_y": 0,
      "scale": [
        1,
        1,
        1
      ]
    }
  ],
  "stations": [
    {
      "id": "work",
      "label": "Holographic console",
      "object_id": "work_console",
      "activity_tags": [
        "work"
      ],
      "approach": [
        -2,
        0,
        -1
      ],
      "interaction": [
        -2,
        0,
        -1
      ],
      "facing": 0,
      "animation": "work",
      "fallback_animation": "interact",
      "behavior": "",
      "metadata": {}
    },
    {
      "id": "call",
      "label": "Comms orb",
      "object_id": "comms_terminal",
      "activity_tags": [
        "call"
      ],
      "approach": [
        -2,
        0,
        1
      ],
      "interaction": [
        -2,
        0,
        1
      ],
      "facing": 180,
      "animation": "phone",
      "fallback_animation": "interact",
      "behavior": "",
      "metadata": {}
    },
    {
      "id": "rest",
      "label": "Gravity rest capsule",
      "object_id": "rest_capsule",
      "activity_tags": [
        "rest"
      ],
      "approach": [
        -4.5,
        0,
        2.5
      ],
      "interaction": [
        -4.5,
        0,
        2.5
      ],
      "facing": 90,
      "animation": "sit",
      "fallback_animation": "interact",
      "behavior": "",
      "metadata": {}
    },
    {
      "id": "read",
      "label": "Read the spectrum archive",
      "object_id": "spectrum_archive",
      "activity_tags": [
        "read"
      ],
      "approach": [
        -4.5,
        0,
        -2.5
      ],
      "interaction": [
        -4.5,
        0,
        -2.5
      ],
      "facing": 90,
      "animation": "read",
      "fallback_animation": "interact",
      "behavior": "",
      "metadata": {}
    },
    {
      "id": "observe",
      "label": "Watch the tidal horizon",
      "object_id": "long_scope",
      "activity_tags": [
        "observe"
      ],
      "approach": [
        6,
        0,
        0.5
      ],
      "interaction": [
        6,
        0,
        0.5
      ],
      "facing": 0,
      "animation": "observe",
      "fallback_animation": "interact",
      "behavior": "",
      "metadata": {}
    },
    {
      "id": "map",
      "label": "Assemble the tidal atlas",
      "object_id": "atlas_plinth",
      "activity_tags": [
        "map"
      ],
      "approach": [
        5.5,
        0,
        2
      ],
      "interaction": [
        5.5,
        0,
        2
      ],
      "facing": -90,
      "animation": "interact",
      "fallback_animation": "interact",
      "behavior": "",
      "metadata": {}
    }
  ],
  "metadata": {
    "author": "Domes for Dots contributors",
    "license": "MIT",
    "content_kind": "original_example",
    "simulation_notice": "Routines and imagined projects are deterministic simulation, not model work."
  }
}
